{
  "$schema":"https://json-schema.org/draft/2020-12/schema",
  "$id":"https://anpos.local/schemas/progressive-delivery.schema.json",
  "title":"ANPOS Progressive Delivery Policy",
  "type":"object",
  "additionalProperties":false,
  "required":["schema_version","status","activation_scope","supported_strategies","required_controls_when_applicable","feature_flag_policy"],
  "properties":{
    "schema_version":{"const":1},
    "status":{"type":"string"},
    "activation_scope":{"type":"string"},
    "supported_strategies":{"type":"array","minItems":1,"items":{"type":"string","minLength":1},"uniqueItems":true},
    "required_controls_when_applicable":{"type":"object","minProperties":5,"additionalProperties":{"type":"boolean"}},
    "feature_flag_policy":{
      "type":"object","additionalProperties":false,
      "required":["owner_required","purpose_required","cleanup_or_review_date_required","client_side_flag_is_not_authorization_boundary"],
      "properties":{
        "owner_required":{"const":true},
        "purpose_required":{"const":true},
        "cleanup_or_review_date_required":{"const":true},
        "client_side_flag_is_not_authorization_boundary":{"const":true}
      }
    }
  }
}
